{
  "contractVersion": 1,
  "route": {
    "key": "attest",
    "method": "POST",
    "path": "/internal/managed-runtime/v2/attest",
    "protocolVersion": 2,
    "requestBodyLimitBytes": 16384,
    "responseBodyLimitBytes": 16384,
    "cacheControl": "no-store"
  },
  "identity": {
    "token": "fixture-token",
    "runtimeInstanceId": "runtime-01",
    "runtimeIncarnation": "boot-01",
    "leaseId": "lease-01",
    "epoch": 4,
    "provisionRequestId": "provision-01",
    "tenantId": "tenant-a",
    "workspaceId": "workspace-a",
    "workspaceGeneration": "7",
    "workspaceCwd": "/runtime/workspace",
    "capabilityDigest": "sha256:aaaaaaaaaaaaaaaaaaaaaaaaaaaaaaaaaaaaaaaaaaaaaaaaaaaaaaaaaaaaaaaa",
    "isolationClass": "session"
  },
  "cases": [
    {
      "id": "success",
      "request": {
        "headers": {
          "authorization": "Bearer fixture-token",
          "cache-control": "no-store",
          "content-type": "application/json",
          "x-qwen-managed-lease-id": "lease-01",
          "x-qwen-managed-lease-epoch": "4"
        },
        "body": {
          "protocolVersion": 2,
          "provisionRequestId": "provision-01",
          "tenantId": "tenant-a",
          "workspaceId": "workspace-a",
          "workspaceGeneration": "7",
          "workspaceCwd": "/runtime/workspace",
          "capabilityDigest": "sha256:aaaaaaaaaaaaaaaaaaaaaaaaaaaaaaaaaaaaaaaaaaaaaaaaaaaaaaaaaaaaaaaa",
          "isolationClass": "session"
        }
      },
      "expected": {
        "status": 200,
        "classification": "ok",
        "body": {
          "protocolVersion": 2,
          "runtimeInstanceId": "runtime-01",
          "runtimeIncarnation": "boot-01",
          "leaseId": "lease-01",
          "epoch": 4,
          "provisionRequestId": "provision-01",
          "tenantId": "tenant-a",
          "workspaceId": "workspace-a",
          "workspaceGeneration": "7",
          "workspaceCwd": "/runtime/workspace",
          "capabilityDigest": "sha256:aaaaaaaaaaaaaaaaaaaaaaaaaaaaaaaaaaaaaaaaaaaaaaaaaaaaaaaaaaaaaaaa",
          "isolationClass": "session"
        }
      }
    },
    {
      "id": "missing-authorization",
      "request": {
        "omitHeader": "authorization"
      },
      "expected": {
        "status": 401,
        "classification": "credentials",
        "code": "managed_runtime_unauthorized"
      }
    },
    {
      "id": "missing-no-store",
      "request": {
        "omitHeader": "cache-control"
      },
      "expected": {
        "status": 400,
        "classification": "protocol",
        "code": "managed_runtime_attestation_invalid"
      }
    },
    {
      "id": "wrong-lease",
      "request": {
        "replaceHeader": {
          "name": "x-qwen-managed-lease-id",
          "value": "lease-02"
        }
      },
      "expected": {
        "status": 409,
        "classification": "identity",
        "code": "managed_runtime_identity_conflict"
      }
    },
    {
      "id": "wrong-epoch",
      "request": {
        "replaceHeader": {
          "name": "x-qwen-managed-lease-epoch",
          "value": "5"
        }
      },
      "expected": {
        "status": 409,
        "classification": "identity",
        "code": "managed_runtime_identity_conflict"
      }
    },
    {
      "id": "wrong-workspace-generation",
      "request": {
        "replaceBody": {
          "name": "workspaceGeneration",
          "value": "8"
        }
      },
      "expected": {
        "status": 409,
        "classification": "identity",
        "code": "managed_runtime_identity_conflict"
      }
    },
    {
      "id": "unknown-body-field",
      "request": {
        "replaceBody": {
          "name": "unexpected",
          "value": true
        }
      },
      "expected": {
        "status": 400,
        "classification": "protocol",
        "code": "managed_runtime_attestation_invalid"
      }
    },
    {
      "id": "wrong-protocol-version",
      "request": {
        "replaceBody": {
          "name": "protocolVersion",
          "value": 3
        }
      },
      "expected": {
        "status": 400,
        "classification": "protocol",
        "code": "managed_runtime_attestation_invalid"
      }
    },
    {
      "id": "malformed-json",
      "request": {
        "rawBody": "{not-json"
      },
      "expected": {
        "status": 400,
        "classification": "protocol",
        "code": "managed_runtime_attestation_invalid"
      }
    },
    {
      "id": "unsupported-json-charset",
      "request": {
        "replaceHeader": {
          "name": "content-type",
          "value": "application/json; charset=iso-8859-1"
        }
      },
      "expected": {
        "status": 400,
        "classification": "protocol",
        "code": "managed_runtime_attestation_invalid"
      }
    },
    {
      "id": "unsupported-content-encoding",
      "request": {
        "replaceHeader": {
          "name": "content-encoding",
          "value": "compress"
        }
      },
      "expected": {
        "status": 400,
        "classification": "protocol",
        "code": "managed_runtime_attestation_invalid"
      }
    },
    {
      "id": "malformed-capability-digest",
      "request": {
        "replaceBody": {
          "name": "capabilityDigest",
          "value": "sha256:not-canonical"
        }
      },
      "expected": {
        "status": 400,
        "classification": "protocol",
        "code": "managed_runtime_attestation_invalid"
      }
    },
    {
      "id": "oversized-body",
      "request": {
        "paddingBytes": 16384
      },
      "expected": {
        "status": 413,
        "classification": "protocol",
        "code": "managed_runtime_attestation_too_large"
      }
    },
    {
      "id": "query-string-route",
      "request": {
        "pathSuffix": "?retry=1"
      },
      "expected": {
        "status": 404,
        "classification": "incompatible"
      }
    },
    {
      "id": "trailing-slash-route",
      "request": {
        "pathSuffix": "/"
      },
      "expected": {
        "status": 404,
        "classification": "incompatible"
      }
    },
    {
      "id": "wrong-method",
      "request": {
        "method": "GET"
      },
      "expected": {
        "status": 404,
        "classification": "incompatible"
      }
    },
    {
      "id": "unknown-path",
      "request": {
        "pathOverride": "/internal/managed-runtime/v2/unknown"
      },
      "expected": {
        "status": 404,
        "classification": "incompatible"
      }
    },
    {
      "id": "wrong-token",
      "request": {
        "replaceHeader": {
          "name": "authorization",
          "value": "Bearer fixture-tokeX"
        }
      },
      "expected": {
        "status": 401,
        "classification": "credentials",
        "code": "managed_runtime_unauthorized"
      }
    },
    {
      "id": "wrong-token-length",
      "request": {
        "replaceHeader": {
          "name": "authorization",
          "value": "Bearer x"
        }
      },
      "expected": {
        "status": 401,
        "classification": "credentials",
        "code": "managed_runtime_unauthorized"
      }
    },
    {
      "id": "wrong-auth-scheme",
      "request": {
        "replaceHeader": {
          "name": "authorization",
          "value": "Digest fixture-token"
        }
      },
      "expected": {
        "status": 401,
        "classification": "credentials",
        "code": "managed_runtime_unauthorized"
      }
    },
    {
      "id": "wrong-provision-request",
      "request": {
        "replaceBody": {
          "name": "provisionRequestId",
          "value": "provision-02"
        }
      },
      "expected": {
        "status": 409,
        "classification": "identity",
        "code": "managed_runtime_identity_conflict"
      }
    },
    {
      "id": "wrong-tenant",
      "request": {
        "replaceBody": {
          "name": "tenantId",
          "value": "tenant-b"
        }
      },
      "expected": {
        "status": 409,
        "classification": "identity",
        "code": "managed_runtime_identity_conflict"
      }
    },
    {
      "id": "wrong-workspace",
      "request": {
        "replaceBody": {
          "name": "workspaceId",
          "value": "workspace-b"
        }
      },
      "expected": {
        "status": 409,
        "classification": "identity",
        "code": "managed_runtime_identity_conflict"
      }
    },
    {
      "id": "wrong-workspace-cwd",
      "request": {
        "replaceBody": {
          "name": "workspaceCwd",
          "value": "/runtime/other"
        }
      },
      "expected": {
        "status": 409,
        "classification": "identity",
        "code": "managed_runtime_identity_conflict"
      }
    },
    {
      "id": "wrong-capability-digest",
      "request": {
        "replaceBody": {
          "name": "capabilityDigest",
          "value": "sha256:bbbbbbbbbbbbbbbbbbbbbbbbbbbbbbbbbbbbbbbbbbbbbbbbbbbbbbbbbbbbbbbb"
        }
      },
      "expected": {
        "status": 409,
        "classification": "identity",
        "code": "managed_runtime_identity_conflict"
      }
    },
    {
      "id": "wrong-isolation-class",
      "request": {
        "replaceBody": {
          "name": "isolationClass",
          "value": "workspace"
        }
      },
      "expected": {
        "status": 409,
        "classification": "identity",
        "code": "managed_runtime_identity_conflict"
      }
    },
    {
      "id": "empty-provision-request",
      "request": {
        "replaceBody": {
          "name": "provisionRequestId",
          "value": ""
        }
      },
      "expected": {
        "status": 400,
        "classification": "protocol",
        "code": "managed_runtime_attestation_invalid"
      }
    },
    {
      "id": "empty-tenant",
      "request": {
        "replaceBody": {
          "name": "tenantId",
          "value": ""
        }
      },
      "expected": {